{
  "claim": "The agent that owns visible UI also owns visual verification.",
  "why_it_matters": "Future handoffs should keep implementation and visible correctness with one owner.",
  "scope": {
    "applies": [
      "visible interface implementation",
      "visual QA"
    ],
    "excludes": [
      "backend data correctness",
      "build verification"
    ]
  },
  "provenance": [
    {
      "kind": "user-statement",
      "value": "User approved ownership by user-visible artifact."
    },
    {
      "kind": "file",
      "value": "AGENTS.md"
    }
  ],
  "confidence": "high",
  "suggested_type": "decision",
  "lifecycle": {
    "status": "active",
    "revalidate_when": [
      "ownership policy changes",
      "visual QA routing changes"
    ],
    "supersedes": []
  }
}
